{
  "schema_version": "0.6.0",
  "document_id": "MIL-STD-464D NOT 1",
  "edition_id": "dla:mil-std-ident:35794:composition:0dfe1899f3fa76de4e4a2c585d27f9363a537b7d484fb72324fef303595113eb",
  "source_pdf_sha256": "5db46d502cdc92352fe9964a9cf843f8e78d4056d208ace8edfeb1fa117b2ed9",
  "source_page_pack_digest": "d49276c251efac4e7288a7cf1437162b62a727dadf4640c147b9045a7067a41e",
  "compiler": {
    "name": "verified_page_pack",
    "version": "0.1.0"
  },
  "extraction_mode": "verified_page_text",
  "text_encoding": "UTF-8",
  "offset_convention": "half_open_utf8_byte_offsets_per_physical_page",
  "review": {
    "reviewer_id": "claude-code-agent-self-review-2026-10",
    "reviewer_type": "agent",
    "reviewed_at": "2026-10-09T00:00:00Z",
    "method": "Agent self-review (Claude Code) of exact page-text spans from the a7 page-text package against the printed clause structure visible in the text layer; conditions, exceptions, tailoring permissions and applicability limits typed as qualifiers; cross-document citations recorded as unresolved relationships; no visual PDF inspection.",
    "tool": {
      "name": "Claude Code agent session",
      "version": "not recorded",
      "configuration_sha256": null
    },
    "unresolved_issues": [
      "Agent self-review only: the reviewing agent authored and checked these annotations; no human or independent review was performed.",
      "Review used the exact verified pypdf layout text layer of component 5db46d502cdc (the standard body) from the a7 corpus package; the separate notice component is not reviewed; PDF pages were not rendered or visually inspected, so text-layer artifacts are preserved verbatim.",
      "Only the selected scope (1.1, 1.2, 4.1, 5.1, 5.2 paragraph text, 5.6, 5.7, 5.7.1 through 5.7.3) is reviewed; 5.2.1 through 5.5, 5.8 onward, appendices, and all other pages remain unreviewed.",
      "Compound clauses are decomposed into derived child records whose identities are authored, not printed source numbering; obligation record counts are not atomic-requirement counts."
    ],
    "attestation": "extraction_review_not_project_applicability_or_approval"
  },
  "nodes": [
    {
      "logical_id": "1.1",
      "kind": "clause",
      "ordinal": 1,
      "clause_reference": "1.1",
      "heading": "1.1 Purpose",
      "statement_role": "governing_note",
      "exact_text": "1.1\nPurpose.\nThis standard establishes electromagnetic environmental effects (E3) interface requirements and\nverification criteria for airborne, sea, space, and ground systems, including associated ordnance.",
      "content_sha256": "032bcc2c004de675c10124dd0dd4b24b1f5f4ff36a878c5bb7c9328cf0c877f5",
      "source_spans": [
        {
          "physical_page": 10,
          "page_text_sha256": "cb45ce4252c6e410d779f5f8f403458e4c646fb75a22d1398d8b363820d1ae19",
          "start_byte": 210,
          "end_byte": 213
        },
        {
          "physical_page": 10,
          "page_text_sha256": "cb45ce4252c6e410d779f5f8f403458e4c646fb75a22d1398d8b363820d1ae19",
          "start_byte": 275,
          "end_byte": 283
        },
        {
          "physical_page": 10,
          "page_text_sha256": "cb45ce4252c6e410d779f5f8f403458e4c646fb75a22d1398d8b363820d1ae19",
          "start_byte": 284,
          "end_byte": 379
        },
        {
          "physical_page": 10,
          "page_text_sha256": "cb45ce4252c6e410d779f5f8f403458e4c646fb75a22d1398d8b363820d1ae19",
          "start_byte": 380,
          "end_byte": 478
        }
      ],
      "derivation": {
        "method": "agent self-review of exact verified page-text byte spans; layout fragments separated by three or more spaces or a line break are joined with one LF; no PDF raster inspection",
        "review_status": "agent_reviewed"
      },
      "semantics": {
        "schema_version": "0.1.0",
        "content_role": "applicability_statement",
        "normativity": "normative",
        "statement": {
          "subject": "This standard",
          "action": "establishes electromagnetic environmental effects (E3) interface requirements",
          "modality": "other",
          "polarity": "affirmative",
          "exact_text": "This standard establishes electromagnetic environmental effects (E3) interface requirements and\nverification criteria for airborne, sea, space, and ground systems, including associated ordnance.",
          "span_indices": [
            2,
            3
          ]
        },
        "qualifiers": [
          {
            "kind": "source_applicability",
            "exact_text": "for airborne, sea, space, and ground systems, including associated ordnance.",
            "span_indices": [
              3
            ]
          }
        ],
        "quantities": [],
        "unresolved_issues": [],
        "project_applicability": "not_decided"
      }
    },
    {
      "logical_id": "1.2",
      "kind": "clause",
      "ordinal": 2,
      "clause_reference": "1.2",
      "heading": "1.2 Application",
      "statement_role": "governing_note",
      "exact_text": "1.2\nApplication.\nThis standard is applicable for complete systems, both new and modified.",
      "content_sha256": "512379959b8f271bdee9f3eeccfc9c72f9972bb15fb9323bccb70c702863b321",
      "source_spans": [
        {
          "physical_page": 10,
          "page_text_sha256": "cb45ce4252c6e410d779f5f8f403458e4c646fb75a22d1398d8b363820d1ae19",
          "start_byte": 479,
          "end_byte": 482
        },
        {
          "physical_page": 10,
          "page_text_sha256": "cb45ce4252c6e410d779f5f8f403458e4c646fb75a22d1398d8b363820d1ae19",
          "start_byte": 544,
          "end_byte": 556
        },
        {
          "physical_page": 10,
          "page_text_sha256": "cb45ce4252c6e410d779f5f8f403458e4c646fb75a22d1398d8b363820d1ae19",
          "start_byte": 557,
          "end_byte": 629
        }
      ],
      "derivation": {
        "method": "agent self-review of exact verified page-text byte spans; layout fragments separated by three or more spaces or a line break are joined with one LF; no PDF raster inspection",
        "review_status": "agent_reviewed"
      },
      "semantics": {
        "schema_version": "0.1.0",
        "content_role": "applicability_statement",
        "normativity": "normative",
        "statement": {
          "subject": "This standard",
          "action": "is applicable for complete systems",
          "modality": "other",
          "polarity": "affirmative",
          "exact_text": "This standard is applicable for complete systems, both new and modified.",
          "span_indices": [
            2
          ]
        },
        "qualifiers": [
          {
            "kind": "source_applicability",
            "exact_text": "both new and modified.",
            "span_indices": [
              2
            ]
          }
        ],
        "quantities": [],
        "unresolved_issues": [],
        "project_applicability": "not_decided"
      }
    },
    {
      "logical_id": "4",
      "kind": "section",
      "ordinal": 3,
      "clause_reference": "4",
      "heading": "4. General requirements",
      "statement_role": "informative",
      "exact_text": "4.\nGENERAL REQUIREMENTS",
      "content_sha256": "e2e56165771a2f2fc2aaa7a8630d1ee62e61f568f4f559c6b26a32ede6d2d2fb",
      "source_spans": [
        {
          "physical_page": 19,
          "page_text_sha256": "09542700209d312d9a1f42dd9c3f199b1360fc59b49589b8d9671c362b3a7a44",
          "start_byte": 90,
          "end_byte": 92
        },
        {
          "physical_page": 19,
          "page_text_sha256": "09542700209d312d9a1f42dd9c3f199b1360fc59b49589b8d9671c362b3a7a44",
          "start_byte": 148,
          "end_byte": 168
        }
      ],
      "derivation": {
        "method": "agent self-review of exact verified page-text byte spans; layout fragments separated by three or more spaces or a line break are joined with one LF; no PDF raster inspection",
        "review_status": "agent_reviewed"
      }
    },
    {
      "logical_id": "4.1",
      "kind": "clause",
      "ordinal": 4,
      "clause_reference": "4.1",
      "heading": "4.1 General",
      "statement_role": "governing_note",
      "exact_text": "4.1\nGeneral.\nEach\nsystem shall be electromagnetically compatible in its operational electromagnetic\nenvironment such that the operational performance requirements are met.  This standard\nidentifies baseline design requirements and verification to address E3 issues.  Requirements and\nverification approaches may be tailored based on engineering justification derived from the\nsystem’s operational requirements and engineering analysis.\nDesign techniques used to achieve\nelectromagnetic compatibility shall be verifiable, maintainable, and effective over the rated life\ncycle of the system.  Design margins shall be established based on system criticality, hardware\ntolerances, and uncertainties involved in verification of system-level design requirements.\nVerification shall address all life cycle aspects of the system, including (as applicable) normal in-\nservice operation, checkout, storage, transportation, handling, packaging, loading, unloading,\nlaunch, and the normal operating procedures associated with each aspect.  T h e\nData Item\nDescription (DID) called out in the standard provide a means for establishing an overall integrated\nE3 design and verification approach to identify areas of concern early in the program, mitigate\nrisk,  and document test  results.",
      "content_sha256": "ebab0122118f7b0f1aa393dce7b24a162632d48000fa08950ee07f01cc062dd9",
      "source_spans": [
        {
          "physical_page": 19,
          "page_text_sha256": "09542700209d312d9a1f42dd9c3f199b1360fc59b49589b8d9671c362b3a7a44",
          "start_byte": 169,
          "end_byte": 172
        },
        {
          "physical_page": 19,